model,id,query,Q_target,Q_trap,baseline_rank,final_rank,final_trap_rank
text-embedding-3-small,excluir_3323,"Besides printing The Seven Pillars of Wisdom by T. E. Lawrence, what else did Herbert John Hodgson experience?",experiences of Herbert John Hodgson,experiences related to printing The Seven Pillars of Wisdom by T. E. Lawrence,1,9,89789
text-embedding-3-small,excluir_3072,"Besides Phil Ivey, who else has made significant achievements and contributions to Ivey League, a poker training website founded by American professional poker player Phil Ivey?",significant achievements and contributions to Ivey League,achievements and contributions by Phil Ivey to Ivey League,1,1234,47426
text-embedding-3-small,excluir_2968,"What kind of membership options does Ivey League offer for different skill levels, excluding any information related to Phil Ivey's involvement?",membership options offered by Ivy League for different skill levels,membership options related to Phil Ivey's involvement,1,1506,89218
text-embedding-3-small,excluir_1147,"What are the main life experiences of Alexander Lincoln, excluding those related to the Louth Park Monastery?",main life experiences of Alexander Lincoln,life experiences of Alexander Lincoln related to the Louth Park Monastery,1,12,89805
text-embedding-3-small,excluir_1525,"Other than Liu Yifei, who else stars in ""For Love or Money""?",stars in 'For Love or Money',Liu Yifei stars in 'For Love or Money',1,148,88777
text-embedding-3-small,excluir_1267,What other professions does Arthur Campbell have apart from working at Darjeeling?,professions of Arthur Campbell,professions of Arthur Campbell working at Darjeeling,1,772,90406
text-embedding-3-small,excluir_95,"Can you tell me about the notable investigations conducted by Robert Ray, without including any investigations done by Ken Starr?",notable investigations conducted by Robert Ray,investigations conducted by Ken Starr,1,9,90374
text-embedding-3-small,excluir_1348,"Can you tell me about George Prosper Verboom's relationship with any historical figure, except for King Philip V of Spain?",George Prosper Verboom's relationship with historical figures,George Prosper Verboom's relationship with King Philip V of Spain,1,13,89561
text-embedding-3-small,excluir_2562,In which field of art did Simon Roy make a significant contribution and not provide any information related to Brandon Graham?,field of art where Simon Roy made a significant contribution,information related to Brandon Graham,1,8,90406
text-embedding-3-small,excluir_2993,"Which teams did Hugo Smaldone play for during his professional football career, excluding any clubs in Argentina?",teams Hugo Smaldone played for during his professional football career,clubs in Argentina that Hugo Smaldone played for,1,24,80242
text-embedding-3-small,excluir_1289,What other groups do Ybor City have besides L'Unione Italiana?,groups in Ybor City,groups in Ybor City besides L'Unione Italiana,1,1218,1
text-embedding-3-small,excluir_123,"How was the Oakland Raiders' season in 2013, without taking into account Terrelle Pryor's performance?",Oakland Raiders' season in 2013,Oakland Raiders' season in 2013 considering Terrelle Pryor's performance,1,8,87547
text-embedding-3-small,excluir_2977,"What is the historical connection between creosote production and a location, other than Bainbridge Island, Washington?",historical connection between creosote production and a location,"historical connection between creosote production and Bainbridge Island, Washington",2,1849,217
